{
  "ref": "research.lookup",
  "version": "1",
  "inputSchemaRef": "schemas/capabilities/research.lookup.input.v1.json",
  "outputSchemaRef": "schemas/capabilities/research.lookup.output.v1.json",
  "riskClass": "read_only",
  "costClass": "variable",
  "allowedDataClassifications": ["public", "internal"],
  "environments": ["sandbox", "production"],
  "requiredPermissions": ["research.lookup"],
  "overrideable": {
    "qualityProfile": ["economy", "balanced", "high"]
  },
  "implementations": [
    {
      "id": "github:yuliabk/agent-factory-research-agent@4a8b308aeaf22228c6a03d438509b0717e6daf8b",
      "environments": ["sandbox"],
      "enabled": true
    }
  ]
}
